<?xml version="1.0" encoding="utf-8"?>

<!DOCTYPE commercial SYSTEM "axl.dtd">

<commercial> 

<client nom="Renard" prenom="Nicolas" mail="nrenard@gmail.com" mobile="0699305567"> 
    <demande>
    <destination>Mexique</destination>
    <periode>Fin mai 2020</periode>
    <duree>7 nuits</duree>
    <nbparticipant>4</nbparticipant>
    <tarifmax>890.00</tarifmax>
    <propositions>
        <proposition>Circuit Maya: Yucatan-Cancùn...</proposition>
        <proposition>Route turquoise: cascades, temples</proposition>
    </propositions>
</demande>
</client>
<client nom="Grenapin" prenom="Dorothée" mail="grenapin@fr-group.com" mobile="0299123455">
</client>
</commercial>